{
  "$schema": "https://json-schema.org/draft/2020-12/schema",
  "$id": "https://crypto-quant-bot.local/contracts/lot43_v4_entry_gate_v1.schema.json",
  "title": "Lot43V4EntryGateV1",
  "type": "object",
  "additionalProperties": false,
  "required": [
    "schema_version",
    "target_lot",
    "base_commit",
    "current_version",
    "gate_status",
    "human_decision",
    "implementation_started",
    "owner",
    "runtime_mode",
    "canonical_roadmap",
    "prerequisites",
    "required_inputs",
    "required_outputs",
    "allowed_scope",
    "forbidden_scope",
    "quality_gates",
    "safety",
    "next_lot",
    "next_lot_status",
    "output_checksum"
  ],
  "properties": {
    "schema_version": {"const": "lot43-v4-entry-gate-v1"},
    "target_lot": {"const": 43},
    "base_commit": {"const": "2438622734e597cdcbada6b926e3c05d9e4cf8bc"},
    "current_version": {"const": "0.42.0"},
    "gate_status": {"const": "GO_LOT43_IMPLEMENTATION_ENTRY"},
    "human_decision": {"const": "APPROVED_START_LOT43"},
    "implementation_started": {"const": false},
    "owner": {"const": "MicrostructureDomain"},
    "runtime_mode": {"const": "OFFLINE_MICROSTRUCTURE_RESEARCH_ONLY"},
    "canonical_roadmap": {
      "type": "object",
      "additionalProperties": false,
      "required": ["source_path", "source_line", "source_blob_sha", "lot_id", "title", "version_id"],
      "properties": {
        "source_path": {"const": "data/audit/product_scope_roadmap_lot21.jsonl"},
        "source_line": {"const": 44},
        "source_blob_sha": {"const": "84de51bda788a8d124fb7d344419c4a4b12030b5"},
        "lot_id": {"const": "Lot 43"},
        "title": {"const": "Book Resilience & Replenishment Engine"},
        "version_id": {"const": "V4_MICROSTRUCTURE_LIQUIDITY"}
      }
    },
    "prerequisites": {
      "type": "object",
      "additionalProperties": false,
      "required": [
        "anti_flake_repetitions",
        "branch_coverage_percent",
        "latest_implemented_lot",
        "line_coverage_percent",
        "lot42_audit_checksum",
        "lot42_evidence_head",
        "lot42_final_pr_head",
        "lot42_gate_merge",
        "lot42_implementation_merge",
        "lot42_post_merge_audit_merge_commit",
        "lot42_post_merge_verdict",
        "lot42_source_head",
        "lot42_state_checksum",
        "lot42_status",
        "lot42_zone_set_checksum",
        "lot43_capability_status",
        "mutation_score_percent",
        "participant_intent_inferred",
        "reference_active_zones_total",
        "reference_book_mid",
        "reference_reconstructed_sequence_id"
      ],
      "properties": {
        "anti_flake_repetitions": {"const": 3},
        "branch_coverage_percent": {"const": 93.07},
        "latest_implemented_lot": {"const": 42},
        "line_coverage_percent": {"const": 98.17},
        "lot42_audit_checksum": {"const": "b562b0cca61e0b10fbacf4a2318ef1075230b57388fe0240de0ca3d200582e3f"},
        "lot42_evidence_head": {"const": "3655b18a24cafb3383dfeb2709904af59044535f"},
        "lot42_final_pr_head": {"const": "85f0a141d52d448a452ff1493050a3bf31a23dce"},
        "lot42_gate_merge": {"const": "7456c5b80b609ee5958d8b6da0effd489faa308c"},
        "lot42_implementation_merge": {"const": "3a7226b4beeb23bfeee976243efc0057cac69e0e"},
        "lot42_post_merge_audit_merge_commit": {"const": "2438622734e597cdcbada6b926e3c05d9e4cf8bc"},
        "lot42_post_merge_verdict": {"const": "GO_LOT42_POST_MERGE"},
        "lot42_source_head": {"const": "2d91da1777f1ccbd7f81563dbc74fd3b89eecdf2"},
        "lot42_state_checksum": {"const": "6e1fe348dc9fdc262d2f27990c6f3234f0b1ed71f5bfb3347fe27a9e458af8b0"},
        "lot42_status": {"const": "IMPLEMENTED_VALIDATED_OFFLINE_LIQUIDITY_ZONES_WALLS_VOIDS_ONLY"},
        "lot42_zone_set_checksum": {"const": "f5769313ec5f9f6de503b1eb9a40c31262ddf0eba6131f791c070f6557168c89"},
        "lot43_capability_status": {"const": "PLANNED_LOCKED"},
        "mutation_score_percent": {"const": 80.1},
        "participant_intent_inferred": {"const": false},
        "reference_active_zones_total": {"const": 3},
        "reference_book_mid": {"const": "50025"},
        "reference_reconstructed_sequence_id": {"const": 1003}
      }
    },
    "required_inputs": {"type": "array", "minItems": 2, "maxItems": 2, "uniqueItems": true, "items": {"type": "string", "minLength": 1}},
    "required_outputs": {"type": "array", "minItems": 3, "maxItems": 3, "uniqueItems": true, "items": {"type": "string", "minLength": 1}},
    "allowed_scope": {"type": "array", "minItems": 16, "maxItems": 16, "uniqueItems": true, "items": {"type": "string", "minLength": 1}},
    "forbidden_scope": {"type": "array", "minItems": 22, "maxItems": 22, "uniqueItems": true, "items": {"type": "string", "minLength": 1}},
    "quality_gates": {
      "type": "object",
      "additionalProperties": false,
      "required": ["line_coverage_min_percent", "branch_coverage_min_percent", "mutation_score_min_percent", "anti_flake_repetitions"],
      "properties": {
        "line_coverage_min_percent": {"const": 95},
        "branch_coverage_min_percent": {"const": 90},
        "mutation_score_min_percent": {"const": 80},
        "anti_flake_repetitions": {"const": 3}
      }
    },
    "safety": {
      "type": "object",
      "additionalProperties": false,
      "required": [
        "analysis_only",
        "approved_size",
        "execution_allowed",
        "external_connectivity_allowed",
        "market_event_publication_allowed",
        "network_ingestion_allowed",
        "order_routing_allowed",
        "participant_behavior_inference_explicitly_labeled",
        "raw_data_mutation_allowed",
        "real_credentials_allowed",
        "risk_approval_allowed",
        "scenario_score_is_signal",
        "signal_generation_allowed",
        "trade_allowed",
        "used_for_decision"
      ],
      "properties": {
        "analysis_only": {"const": true},
        "approved_size": {"const": 0},
        "execution_allowed": {"const": false},
        "external_connectivity_allowed": {"const": false},
        "market_event_publication_allowed": {"const": false},
        "network_ingestion_allowed": {"const": false},
        "order_routing_allowed": {"const": false},
        "participant_behavior_inference_explicitly_labeled": {"const": true},
        "raw_data_mutation_allowed": {"const": false},
        "real_credentials_allowed": {"const": false},
        "risk_approval_allowed": {"const": false},
        "scenario_score_is_signal": {"const": false},
        "signal_generation_allowed": {"const": false},
        "trade_allowed": {"const": false},
        "used_for_decision": {"const": false}
      }
    },
    "next_lot": {"const": 44},
    "next_lot_status": {"const": "PLANNED_LOCKED"},
    "output_checksum": {"type": "string", "pattern": "^[0-9a-f]{64}$"}
  }
}
