{
  "allowed_scope": [
    "OFFLINE_BOOK_RESILIENCE_REPLENISHMENT_ANALYSIS",
    "DEPLETION_EVENT_DETECTION",
    "REPLENISHMENT_TIME_MEASUREMENT",
    "REPLENISHMENT_QUANTITY_MEASUREMENT",
    "SAME_PRICE_REPLENISHMENT_CLASSIFICATION",
    "ADJACENT_PRICE_REPLENISHMENT_CLASSIFICATION",
    "MID_SHIFT_REPLENISHMENT_CLASSIFICATION",
    "SIDE_SPECIFIC_RESILIENCE_MEASUREMENT",
    "HORIZON_SPECIFIC_RESILIENCE_MEASUREMENT",
    "VOLATILITY_REGIME_CONDITIONING",
    "EXPIRED_REPLENISHMENT_WINDOW_REJECTION",
    "BOOK_RESILIENCE_STATE_V1",
    "NO_PARTICIPANT_INTENT_ASSERTION",
    "VERSIONED_CONFIG_AND_LINEAGE_BINDING",
    "DETERMINISTIC_STATE_AUDIT_PERSISTENCE",
    "FULL_CHAIN_VALIDATION_UNTIL_LOT43"
  ],
  "base_commit": "2438622734e597cdcbada6b926e3c05d9e4cf8bc",
  "canonical_roadmap": {
    "lot_id": "Lot 43",
    "source_blob_sha": "84de51bda788a8d124fb7d344419c4a4b12030b5",
    "source_line": 44,
    "source_path": "data/audit/product_scope_roadmap_lot21.jsonl",
    "title": "Book Resilience & Replenishment Engine",
    "version_id": "V4_MICROSTRUCTURE_LIQUIDITY"
  },
  "current_version": "0.42.0",
  "forbidden_scope": [
    "EXTERNAL_NETWORK_ACCESS",
    "LIVE_EXCHANGE_DATA",
    "REAL_CREDENTIALS",
    "NETWORK_INGESTION",
    "TRADE_AGGRESSOR_CLASSIFICATION",
    "ORDER_FLOW_DELTA_CVD_ENGINE",
    "CLASSIFICATION_CONFIDENCE_ENGINE",
    "ABSORPTION_HIDDEN_LIQUIDITY_INFERENCE",
    "VOLUME_CLUSTER_TIME_AT_LEVEL_ENGINE",
    "STOP_ZONE_LIQUIDITY_POOL_INFERENCE",
    "SWEEP_FAKEOUT_TRAP_FAILED_AUCTION_ENGINE",
    "DERIVATIVES_CONTEXT_ENGINE",
    "GAME_THEORY_SCENARIO_AGGREGATION",
    "CANCELLATION_INTENT_INFERENCE",
    "PARTICIPANT_INTENT_AS_FACT",
    "SCENARIO_TO_SIGNAL_CONVERSION",
    "FORECAST_GENERATION",
    "SIGNAL_GENERATION",
    "RISK_APPROVAL",
    "ORDER_ROUTING",
    "TRADING",
    "EXECUTION"
  ],
  "gate_status": "GO_LOT43_IMPLEMENTATION_ENTRY",
  "human_decision": "APPROVED_START_LOT43",
  "implementation_started": false,
  "next_lot": 44,
  "next_lot_status": "PLANNED_LOCKED",
  "output_checksum": "4034c86061234a627dafde6122439c3b697fb2d53a1b95ba4e58f77a71089e6d",
  "owner": "MicrostructureDomain",
  "prerequisites": {
    "anti_flake_repetitions": 3,
    "branch_coverage_percent": 93.07,
    "latest_implemented_lot": 42,
    "line_coverage_percent": 98.17,
    "lot42_audit_checksum": "b562b0cca61e0b10fbacf4a2318ef1075230b57388fe0240de0ca3d200582e3f",
    "lot42_evidence_head": "3655b18a24cafb3383dfeb2709904af59044535f",
    "lot42_final_pr_head": "85f0a141d52d448a452ff1493050a3bf31a23dce",
    "lot42_gate_merge": "7456c5b80b609ee5958d8b6da0effd489faa308c",
    "lot42_implementation_merge": "3a7226b4beeb23bfeee976243efc0057cac69e0e",
    "lot42_post_merge_audit_merge_commit": "2438622734e597cdcbada6b926e3c05d9e4cf8bc",
    "lot42_post_merge_verdict": "GO_LOT42_POST_MERGE",
    "lot42_source_head": "2d91da1777f1ccbd7f81563dbc74fd3b89eecdf2",
    "lot42_state_checksum": "6e1fe348dc9fdc262d2f27990c6f3234f0b1ed71f5bfb3347fe27a9e458af8b0",
    "lot42_status": "IMPLEMENTED_VALIDATED_OFFLINE_LIQUIDITY_ZONES_WALLS_VOIDS_ONLY",
    "lot42_zone_set_checksum": "f5769313ec5f9f6de503b1eb9a40c31262ddf0eba6131f791c070f6557168c89",
    "lot43_capability_status": "PLANNED_LOCKED",
    "mutation_score_percent": 80.1,
    "participant_intent_inferred": false,
    "reference_active_zones_total": 3,
    "reference_book_mid": "50025",
    "reference_reconstructed_sequence_id": 1003
  },
  "quality_gates": {
    "anti_flake_repetitions": 3,
    "branch_coverage_min_percent": 90,
    "line_coverage_min_percent": 95,
    "mutation_score_min_percent": 80
  },
  "required_inputs": [
    "RunContextV1 (run_id, runtime_mode, config_version, code_commit, correlation_id)",
    "LineageEnvelopeV1 des artefacts produits par les lots préalables"
  ],
  "required_outputs": [
    "BookResilienceReplenishmentEngineStateV1",
    "BookResilienceReplenishmentEngineAuditV1",
    "BookResilienceStateV1"
  ],
  "runtime_mode": "OFFLINE_MICROSTRUCTURE_RESEARCH_ONLY",
  "safety": {
    "analysis_only": true,
    "approved_size": 0,
    "execution_allowed": false,
    "external_connectivity_allowed": false,
    "market_event_publication_allowed": false,
    "network_ingestion_allowed": false,
    "order_routing_allowed": false,
    "participant_behavior_inference_explicitly_labeled": true,
    "raw_data_mutation_allowed": false,
    "real_credentials_allowed": false,
    "risk_approval_allowed": false,
    "scenario_score_is_signal": false,
    "signal_generation_allowed": false,
    "trade_allowed": false,
    "used_for_decision": false
  },
  "schema_version": "lot43-v4-entry-gate-v1",
  "target_lot": 43
}
